{"schema":"runtime-bank-index@1","bank_revision":"4b52b91b0608b2147c0bf93f6a6776d8","files":{"c-achievement_biology-01":{"path":"c/achievement_biology-01.json","sha256":"2ba0ec7f9bcb8c5489fb8c84bb0f734d6b4ab6b3187eaf3d897e61e1265c7c0a","bytes":30357},"c-achievement_chemistry-01":{"path":"c/achievement_chemistry-01.json","sha256":"e677206096f6f8c1340b6e609e2300db2c075e7413d44784da0f66450bd450c3","bytes":25635},"c-achievement_math-01":{"path":"c/achievement_math-01.json","sha256":"0d054e5456c56760d8eb30dda4a4e2625beece221651d3dde61ddd9b2e7112d4","bytes":22742},"c-achievement_physics-01":{"path":"c/achievement_physics-01.json","sha256":"50c6c9bdbf8832eba8ab61c1afd9b63d3a651b2f924e29fb658c6da3b70331ee","bytes":27057},"c-aptitude_quantitative-01":{"path":"c/aptitude_quantitative-01.json","sha256":"818496c3966c4497c4535ccaa2dfc12d894a2793225ceeb2ea47e1399743dbb2","bytes":50964},"c-aptitude_verbal-01":{"path":"c/aptitude_verbal-01.json","sha256":"8ff00b8ded67d50c13c4330ac14f039ae54acac21bf4f75fce146ba254301b78","bytes":57609},"k-achievement_biology-01":{"path":"k/achievement_biology-01.json","sha256":"a190900a0a153f0d7306a7de7cd9071c14ebd42b4a5c384cfad1a3d24509404f","bytes":34083},"k-achievement_chemistry-01":{"path":"k/achievement_chemistry-01.json","sha256":"e79976de693fb5aa4949249724dcf3043dacb8e166eb4edde595a2259cef1189","bytes":27188},"k-achievement_math-01":{"path":"k/achievement_math-01.json","sha256":"01b39c658f931d7286a726a77726432bbb28592fe1ccc19589c6e3e2ae861c31","bytes":20354},"k-achievement_physics-01":{"path":"k/achievement_physics-01.json","sha256":"790235468de649a365d8e85b52fafef9588cad17cd684aa42f57789da5131982","bytes":24753},"k-aptitude_quantitative-01":{"path":"k/aptitude_quantitative-01.json","sha256":"0802ce446b93d9ac0a181f62baefb4f994c2c76e4d9302c5367861e10f91a6fe","bytes":40026},"k-aptitude_verbal-01":{"path":"k/aptitude_verbal-01.json","sha256":"0e4bec237ff1f5cd4e7b85f97009a6182e7879c79cf64ae3e72a010ceeb43d46","bytes":45342},"s-achievement_biology":{"path":"sel/achievement_biology.json","sha256":"a358d8776c8eb8693e04d4fa5a7a4a018d6737bd51026b76abdfbc0870307779","bytes":4316},"s-achievement_chemistry":{"path":"sel/achievement_chemistry.json","sha256":"a1de579ad164731626e6b9c063b8e262b0b3eed9337a530326f9444f555d5b5d","bytes":4527},"s-achievement_math":{"path":"sel/achievement_math.json","sha256":"99bc52103a046c87ef365aeb777ff7aa3d37cf034d03b27b5397ea2ae6813241","bytes":4083},"s-achievement_physics":{"path":"sel/achievement_physics.json","sha256":"0a725951a6557977ae48c69a49984e359e81ab4a396f2ac9ecbfc215dfa807ca","bytes":4356},"s-aptitude_quantitative":{"path":"sel/aptitude_quantitative.json","sha256":"7b6975962cc8172e7c4a8ace6216ddd8dce3c6755153fa9f6316c0b30cc50fdf","bytes":8875},"s-aptitude_verbal":{"path":"sel/aptitude_verbal.json","sha256":"58e0107ecc4dc597f6a244db757bd3cfe6297c131f56aa2e790e7ab41595f3e6","bytes":6505}},"nodes":{"prep:achievement/biology":{"counts":{"1":13,"2":18,"3":8},"sel":"s-achievement_biology"},"prep:achievement/biology/biochemistry":{"counts":{"1":1,"2":3,"3":1},"sel":"s-achievement_biology"},"prep:achievement/biology/cells":{"counts":{"1":2,"2":2,"3":1},"sel":"s-achievement_biology"},"prep:achievement/biology/classification-evolution":{"counts":{"1":1,"2":2,"3":1},"sel":"s-achievement_biology"},"prep:achievement/biology/ecology":{"counts":{"1":2,"2":2,"3":1},"sel":"s-achievement_biology"},"prep:achievement/biology/genetics":{"counts":{"1":1,"2":2,"3":2},"sel":"s-achievement_biology"},"prep:achievement/biology/human-body":{"counts":{"1":2,"2":2,"3":1},"sel":"s-achievement_biology"},"prep:achievement/biology/microbiology":{"counts":{"1":2,"2":3,"3":0},"sel":"s-achievement_biology"},"prep:achievement/biology/plants":{"counts":{"1":2,"2":2,"3":1},"sel":"s-achievement_biology"},"prep:achievement/chemistry":{"counts":{"1":14,"2":18,"3":7},"sel":"s-achievement_chemistry"},"prep:achievement/chemistry/acids-bases":{"counts":{"1":2,"2":2,"3":1},"sel":"s-achievement_chemistry"},"prep:achievement/chemistry/atomic-structure":{"counts":{"1":2,"2":2,"3":1},"sel":"s-achievement_chemistry"},"prep:achievement/chemistry/bonding":{"counts":{"1":2,"2":2,"3":1},"sel":"s-achievement_chemistry"},"prep:achievement/chemistry/organic":{"counts":{"1":2,"2":2,"3":1},"sel":"s-achievement_chemistry"},"prep:achievement/chemistry/periodic-table":{"counts":{"1":2,"2":2,"3":1},"sel":"s-achievement_chemistry"},"prep:achievement/chemistry/solutions":{"counts":{"1":1,"2":3,"3":1},"sel":"s-achievement_chemistry"},"prep:achievement/chemistry/stoichiometry":{"counts":{"1":1,"2":3,"3":0},"sel":"s-achievement_chemistry"},"prep:achievement/chemistry/thermochemistry":{"counts":{"1":2,"2":2,"3":1},"sel":"s-achievement_chemistry"},"prep:achievement/math":{"counts":{"1":14,"2":17,"3":8},"sel":"s-achievement_math"},"prep:achievement/math/algebra":{"counts":{"1":2,"2":2,"3":1},"sel":"s-achievement_math"},"prep:achievement/math/calculus":{"counts":{"1":2,"2":3,"3":1},"sel":"s-achievement_math"},"prep:achievement/math/functions":{"counts":{"1":2,"2":3,"3":1},"sel":"s-achievement_math"},"prep:achievement/math/geometry":{"counts":{"1":2,"2":2,"3":1},"sel":"s-achievement_math"},"prep:achievement/math/matrices":{"counts":{"1":1,"2":2,"3":1},"sel":"s-achievement_math"},"prep:achievement/math/sequences":{"counts":{"1":2,"2":1,"3":1},"sel":"s-achievement_math"},"prep:achievement/math/statistics-probability":{"counts":{"1":1,"2":3,"3":1},"sel":"s-achievement_math"},"prep:achievement/math/trigonometry":{"counts":{"1":2,"2":1,"3":1},"sel":"s-achievement_math"},"prep:achievement/physics":{"counts":{"1":14,"2":17,"3":8},"sel":"s-achievement_physics"},"prep:achievement/physics/electricity":{"counts":{"1":1,"2":3,"3":1},"sel":"s-achievement_physics"},"prep:achievement/physics/energy-work":{"counts":{"1":2,"2":2,"3":1},"sel":"s-achievement_physics"},"prep:achievement/physics/forces-motion":{"counts":{"1":2,"2":2,"3":1},"sel":"s-achievement_physics"},"prep:achievement/physics/kinematics":{"counts":{"1":2,"2":2,"3":1},"sel":"s-achievement_physics"},"prep:achievement/physics/modern-physics":{"counts":{"1":1,"2":3,"3":1},"sel":"s-achievement_physics"},"prep:achievement/physics/optics":{"counts":{"1":2,"2":2,"3":1},"sel":"s-achievement_physics"},"prep:achievement/physics/thermodynamics":{"counts":{"1":2,"2":1,"3":1},"sel":"s-achievement_physics"},"prep:achievement/physics/waves-sound":{"counts":{"1":2,"2":2,"3":1},"sel":"s-achievement_physics"},"prep:aptitude/quantitative":{"counts":{"1":27,"2":36,"3":15},"sel":"s-aptitude_quantitative"},"prep:aptitude/quantitative/algebra":{"counts":{"1":4,"2":6,"3":1},"sel":"s-aptitude_quantitative"},"prep:aptitude/quantitative/arithmetic":{"counts":{"1":3,"2":2,"3":3},"sel":"s-aptitude_quantitative"},"prep:aptitude/quantitative/comparison":{"counts":{"1":4,"2":5,"3":2},"sel":"s-aptitude_quantitative"},"prep:aptitude/quantitative/data-interpretation":{"counts":{"1":3,"2":3,"3":2},"sel":"s-aptitude_quantitative"},"prep:aptitude/quantitative/fractions-percent":{"counts":{"1":4,"2":5,"3":2},"sel":"s-aptitude_quantitative"},"prep:aptitude/quantitative/geometry":{"counts":{"1":4,"2":5,"3":2},"sel":"s-aptitude_quantitative"},"prep:aptitude/quantitative/ratio-proportion":{"counts":{"1":3,"2":5,"3":2},"sel":"s-aptitude_quantitative"},"prep:aptitude/quantitative/statistics":{"counts":{"1":2,"2":5,"3":1},"sel":"s-aptitude_quantitative"},"prep:aptitude/verbal":{"counts":{"1":21,"2":27,"3":12},"sel":"s-aptitude_verbal"},"prep:aptitude/verbal/analogy":{"counts":{"1":5,"2":6,"3":3},"sel":"s-aptitude_verbal"},"prep:aptitude/verbal/contextual-error":{"counts":{"1":4,"2":5,"3":2},"sel":"s-aptitude_verbal"},"prep:aptitude/verbal/odd-word-out":{"counts":{"1":3,"2":4,"3":1},"sel":"s-aptitude_verbal"},"prep:aptitude/verbal/reading-comprehension":{"counts":{"1":5,"2":6,"3":4},"sel":"s-aptitude_verbal"},"prep:aptitude/verbal/sentence-completion":{"counts":{"1":4,"2":6,"3":2},"sel":"s-aptitude_verbal"}}}
