{"schema":"runtime-bank-index@1","bank_revision":"b8fb25ce578c32d41d1c6bb2f7d8f517","files":{"c-aptitude_verbal-01":{"path":"c/aptitude_verbal-01.json","sha256":"f2f7fbfa333396b3ae52f4c4b5ca9d187cf9ef02e24bb612accc94059b0f520a","bytes":4702},"c-middle_grade-1_math-01":{"path":"c/middle_grade-1_math-01.json","sha256":"570cec9644d9d7cef2e2acf512db22f0b06e3d70fd036956d02b6cbe31b54da7","bytes":14846},"c-middle_grade-1_science-01":{"path":"c/middle_grade-1_science-01.json","sha256":"6b8fd0f0007c38eef7a49444be4e7640b168993d340202bbfc9e959907942f36","bytes":2373},"k-aptitude_verbal-01":{"path":"k/aptitude_verbal-01.json","sha256":"af2acbc4832b4942b53ec499dc96a88f0dde95a56f0b23345ab18998359d790d","bytes":3473},"k-middle_grade-1_math-01":{"path":"k/middle_grade-1_math-01.json","sha256":"c9b0c7975207872b3bc86df786bb104401e0ecd63b79a1c4a84f320d2854b455","bytes":17529},"k-middle_grade-1_science-01":{"path":"k/middle_grade-1_science-01.json","sha256":"b46385e63c650132db5e0a207380f884e337ad844fd07ec45580ce6b74e63e07","bytes":2816},"s-aptitude_verbal":{"path":"sel/aptitude_verbal.json","sha256":"9c71dacc013acba5ab25d9f5bb98608dbe3cf0d38b46129cce24d8d6a4bc9a21","bytes":1090},"s-middle_grade-1_math":{"path":"sel/middle_grade-1_math.json","sha256":"71ee97d25ae5eb380e3fe8879bae77a60f57c2ae151bfcbff4fef8e3f08658f5","bytes":3685},"s-middle_grade-1_science":{"path":"sel/middle_grade-1_science.json","sha256":"5abd009831bb621a6e2bb3bc533c7b81ed37a3bb399b0d5e373d8fc4919654bd","bytes":842}},"nodes":{"middle/grade-1/math":{"counts":{"1":11,"2":11,"3":9},"sel":"s-middle_grade-1_math"},"middle/grade-1/math/n53":{"counts":{"1":3,"2":2,"3":1},"sel":"s-middle_grade-1_math"},"middle/grade-1/math/n54":{"counts":{"1":2,"2":2,"3":2},"sel":"s-middle_grade-1_math"},"middle/grade-1/math/n55":{"counts":{"1":1,"2":2,"3":2},"sel":"s-middle_grade-1_math"},"middle/grade-1/math/n61":{"counts":{"1":2,"2":2,"3":2},"sel":"s-middle_grade-1_math"},"middle/grade-1/math/n62":{"counts":{"1":2,"2":2,"3":2},"sel":"s-middle_grade-1_math"},"middle/grade-1/math/n91":{"counts":{"1":7,"2":6,"3":5},"sel":"s-middle_grade-1_math"},"middle/grade-1/math/n92":{"counts":{"1":4,"2":5,"3":4},"sel":"s-middle_grade-1_math"},"middle/grade-1/math/x5a3afdd4":{"counts":{"1":0,"2":1,"3":0},"sel":"s-middle_grade-1_math"},"middle/grade-1/math/xb321f898":{"counts":{"1":1,"2":0,"3":0},"sel":"s-middle_grade-1_math"},"middle/grade-1/science":{"counts":{"1":2,"2":2,"3":1},"sel":"s-middle_grade-1_science"},"middle/grade-1/science/x9368a8a7":{"counts":{"1":2,"2":2,"3":1},"sel":"s-middle_grade-1_science"},"middle/grade-1/science/xa3e7e839":{"counts":{"1":1,"2":0,"3":0},"sel":"s-middle_grade-1_science"},"middle/grade-1/science/xc241a07b":{"counts":{"1":1,"2":1,"3":0},"sel":"s-middle_grade-1_science"},"middle/grade-1/science/xc8b1a031":{"counts":{"1":1,"2":2,"3":1},"sel":"s-middle_grade-1_science"},"middle/grade-1/science/xe389fa43":{"counts":{"1":0,"2":1,"3":1},"sel":"s-middle_grade-1_science"},"prep:aptitude/verbal":{"counts":{"1":3,"2":4,"3":2},"sel":"s-aptitude_verbal"},"prep:aptitude/verbal/analogy":{"counts":{"1":1,"2":2,"3":1},"sel":"s-aptitude_verbal"},"prep:aptitude/verbal/contextual-error":{"counts":{"1":1,"2":1,"3":1},"sel":"s-aptitude_verbal"},"prep:aptitude/verbal/odd-word-out":{"counts":{"1":1,"2":1,"3":0},"sel":"s-aptitude_verbal"}}}
